<?xml version="1.0" encoding="utf-8"?>
<!DOCTYPE rechnungen SYSTEM "rechnungensBeschreibung.dtd">
<rechnungen><!-- Mat: 82356 Gruppe 0 -->
	<rechnung>
		<absender>
			<name>Rochade-La Hoff Pharma GmbH</name>
			<adresse>
				<strasse>An der Chemie</strasse>
				<haus-nummer>17</haus-nummer>
				<postleitzahl>79639</postleitzahl>
				<ort>Grenzych-Wahlen</ort>
			</adresse>
			<kontakt>
				<telefon>07624/666333999</telefon>
				<fax>07624/666333990</fax>
			</kontakt>
		</absender>
		<empfaenger>
			<name>Dr.med.Cyprian Zottel</name>
			<adresse>
				<strasse>Soddelstrudel</strasse>
				<haus-nummer>5a</haus-nummer>
				<postleitzahl>13023</postleitzahl>
				<ort>Zotenheim</ort>
			</adresse>
		</empfaenger>
		<leistungen>
			<leistung>
				<menge>3 Packungen</menge>
				<produkt>Grippemittel"Tumifla"</produkt>
				<einzel-preis waehrung="Euro">120.00</einzel-preis>
				<gesamt-preis waehrung="Euro">360.00</gesamt-preis>
				<mehr-wert-steuer>19</mehr-wert-steuer>
			</leistung>
			<leistung>
				<menge></menge>
				<produkt>Beratung pauschal</produkt>
				<einzel-preis waehrung="Euro"></einzel-preis>
				<gesamt-preis waehrung="Euro">50.00</gesamt-preis>
				<mehr-wert-steuer>19</mehr-wert-steuer>
			</leistung>
			<leistung>
				<menge>2 Liter</menge>
				<produkt>Abführmittel"Wech damit" pro Liter</produkt>
				<einzel-preis waehrung="Euro">99.99</einzel-preis>
				<gesamt-preis waehrung="Euro">199.98</gesamt-preis>
				<mehr-wert-steuer>19</mehr-wert-steuer>
			</leistung>
			<leistung>
				<menge>2 Stück</menge>
				<produkt>Energieriegel "Satto"</produkt>
				<einzel-preis waehrung="Euro">5.98</einzel-preis>
				<gesamt-preis waehrung="Euro">11.96</gesamt-preis>
				<mehr-wert-steuer>7</mehr-wert-steuer>
			</leistung>
		</leistungen>
		<daten>
			<steuer-nummer>DE333666999</steuer-nummer>
			<ausstellungs-datum>2017-08-08</ausstellungs-datum>
			<rechnungs-nummer>98-798-7987</rechnungs-nummer>
			<abrechnung>
				<betrag waehrung="Euro">962.22</betrag>
				<netto waehrung="Euro">490.22</netto>
				<mehr-wert-steuer-gesamt waehrung="Euro">116.74</mehr-wert-steuer-gesamt>
			</abrechnung>
		</daten>
	</rechnung>
</rechnungen>